{
  "confidence": {
    "level": "MEDIUM",
    "rationale": "Some useful context was returned, but provider gaps, denials or truncation remain."
  },
  "constraints": {
    "available_more": false,
    "max_excerpt_chars": 260,
    "max_items": 5,
    "provider_timeout_seconds": 20,
    "request_privacy_domain": "PROJECT_PRIVATE",
    "token_usage": "NOT_METERED",
    "truncated": false
  },
  "generated_at": "2026-08-08T19:57:56Z",
  "knowledge_items": [
    {
      "category": "project_knowledge",
      "confidence": "MEDIUM",
      "excerpt": "title=AzurMenton guide bundle; candidate_id=pp-azurmenton-guides; score=9.55887575511929",
      "id": "cortexabv:azur-menton:pp-azurmenton-guides",
      "privacy_classification": "PROJECT_PRIVATE",
      "provenance": {
        "candidate_id": "pp-azurmenton-guides",
        "evidence_refs": [
          {
            "digest": "d1a9f8c7b6a5e4d3c2b1a09876543210fedcba9876543210abcdef1234567890ab",
            "path": "cortex-abv/public-presence-index.v1.json",
            "ref": "projects.azur-menton.links"
          }
        ],
        "tenant": "azur-menton"
      },
      "provider": "cortexabv",
      "summary": "CortexABV candidate match in azur-menton; matched terms: azurmenton, cards, faq, guides, local, onboarding, place, practical.",
      "title": "AzurMenton guide bundle"
    }
  ],
  "known_gaps": [
    "CortexABV AzurMenton retrieval currently surfaces a compact guide bundle only; durable decisions and richer editorial history remain absent."
  ],
  "operational_context": [
    {
      "current_outcome": "Human-initiated guide published in four locales with cover, five intentional place-card placeholders, provenance evidence and a Media Event candidate; no external distribution performed.",
      "evidence_refs": [
        "evidence/onboarding/project-onboarding-002/azurmenton-005-outcome.evidence.json",
        "evidence/onboarding/project-onboarding-002/azurmenton-004-outcome.evidence.json",
        "evidence/onboarding/project-onboarding-002/azurmenton-003-outcome.evidence.json",
        "evidence/onboarding/project-onboarding-002/azurmenton-002-outcome.evidence.json",
        "evidence/onboarding/project-onboarding-002/azurmenton-001-outcome.evidence.json",
        "docs/audits/azurmenton-005-second-pass-image-todo.md",
        "media/events/azurmenton-005-new-guide.json",
        "docs/audits/project-onboarding-002-azurmenton-strategy-gap-report.md"
      ],
      "human_attention_required": true,
      "next_action": "Owner review of the published guide, second-pass image package and Media Event distribution decision",
      "operational_state": "ACTIVE",
      "project": "azurmenton",
      "source": "ABVX-OS",
      "waiting_reason": null
    }
  ],
  "pack_id": "azurmenton-editorial",
  "privacy_classification": "PROJECT_PRIVATE",
  "proof_assets": [
    {
      "digest": "d1a9f8c7b6a5e4d3c2b1a09876543210fedcba9876543210abcdef1234567890ab",
      "path": "cortex-abv/public-presence-index.v1.json",
      "privacy_classification": "PROJECT_PRIVATE",
      "provider": "cortexabv",
      "ref": "projects.azur-menton.links",
      "tenant": "azur-menton"
    }
  ],
  "providers": [
    {
      "available_more": false,
      "elapsed_ms": 165,
      "id": "cortexabv",
      "items_returned": 1,
      "known_gaps": [
        "CortexABV AzurMenton retrieval currently surfaces a compact guide bundle only; durable decisions and richer editorial history remain absent."
      ],
      "privacy_classification": "PROJECT_PRIVATE",
      "status": "partial",
      "truncated": false
    }
  ],
  "relevant_decisions": [],
  "relevant_projects": [],
  "request": {
    "consumer": "azurmenton-internal-assistant",
    "context_budget": {
      "max_excerpt_chars": 260,
      "provider_timeout_seconds": 20,
      "token_usage": "NOT_METERED"
    },
    "domains": [
      "editorial",
      "repair-guidance",
      "menton"
    ],
    "entities": [
      "AzurMenton",
      "Menton",
      "computer repair",
      "phone repair"
    ],
    "freshness_requirement": "RECENT",
    "intent": "editorial_project_retrieval",
    "max_items": 5,
    "privacy_domain": "PROJECT_PRIVATE",
    "provider_hints": [
      "cortexabv"
    ],
    "related_projects": [
      "azurmenton"
    ],
    "request_id": "azurmenton-editorial",
    "schema_version": "v1",
    "task": "Give me existing project knowledge relevant to practical computer and phone repair guidance in Menton, including related guides and project context if known."
  },
  "schema_version": "v1",
  "sources": [
    {
      "digest": "d1a9f8c7b6a5e4d3c2b1a09876543210fedcba9876543210abcdef1234567890ab",
      "path": "cortex-abv/public-presence-index.v1.json",
      "privacy_classification": "PROJECT_PRIVATE",
      "provider": "cortexabv",
      "ref": "projects.azur-menton.links",
      "tenant": "azur-menton"
    }
  ]
}
